,id,name,genres,publisher,year,page_count,purchase_link,price,avg_rating,num_ratings,maturity_rating,language,description,image,authors,AuthorConnections,PublisherConnections
97,97,Humanisation?,['Psychology'],Routledge,2018-06-19,112.0,https://play.google.com/store/books/details?id=ryVhDwAAQBAJ&rdid=book-ryVhDwAAQBAJ&rdot=1&source=gbs_api,34.95,,,NOT_MATURE,en,"Unquenched desire, the dividing up of the drives, repetition, and symptom are the keywords for the effects that the unconscious, as deciphered by Freud, has on the body. Harmony is not on the agenda, but rather the discordance, unlinking, and arrogance of cynical jouissances. It seems that the discourse of capitalism is today increasing their deleterious consequences – with all of these demonstrative suicides, but also suicides as diverse as those of terrorists, Tibetan monks, those beleaguered by the capitalist enterprise, and all the hopeless of our time. Hence the question that Lacan posed concerning the possible ""humanisation"" of this denatured animal, about whom Freud did not hesitate to say that he is a wolf to man, even though he has always made community. What will the psychoanalyst say about possible solutions, he whose act excludes the call to norms of any kind? Humanisation? is the 2013–2014 volume of the annual seminar held by the author at the Clinical College of the Lacanian Field in Paris.",http://books.google.com/books/content?id=ryVhDwAAQBAJ&printsec=frontcover&img=1&zoom=1&edge=curl&source=gbs_api,['Colette Soler'],"[26, 27]","[433, 433]"
98,98,L'époque des traumatismes-The era of traumatism,['Education'],,2005,133.0,,,,,NOT_MATURE,en,,,['Colette Soler'],"[26, 27]",[]
99,99,Humanisation?,['Psychology'],Routledge,2018-06-19,112.0,https://play.google.com/store/books/details?id=4-1gDwAAQBAJ&rdid=book-4-1gDwAAQBAJ&rdot=1&source=gbs_api,34.95,,,NOT_MATURE,en,"Unquenched desire, the dividing up of the drives, repetition, and symptom are the keywords for the effects that the unconscious, as deciphered by Freud, has on the body. Harmony is not on the agenda, but rather the discordance, unlinking, and arrogance of cynical jouissances. It seems that the discourse of capitalism is today increasing their deleterious consequences – with all of these demonstrative suicides, but also suicides as diverse as those of terrorists, Tibetan monks, those beleaguered by the capitalist enterprise, and all the hopeless of our time. Hence the question that Lacan posed concerning the possible ""humanisation"" of this denatured animal, about whom Freud did not hesitate to say that he is a wolf to man, even though he has always made community. What will the psychoanalyst say about possible solutions, he whose act excludes the call to norms of any kind? Humanisation? is the 2013–2014 volume of the annual seminar held by the author at the Clinical College of the Lacanian Field in Paris.",http://books.google.com/books/content?id=4-1gDwAAQBAJ&printsec=frontcover&img=1&zoom=1&edge=curl&source=gbs_api,['Colette Soler'],"[26, 27]","[433, 433]"
100,100,Lacan,,,2018-12-31,,,,,,NOT_MATURE,en,,,['Colette Soler'],"[26, 27]",[]
101,101,Lacan - The Unconscious Reinvented,['Psychology'],Routledge,2018-04-17,246.0,,,,,NOT_MATURE,en,"Has Jacques Lacan's impact on psychoanalysis really been assessed? His formulation that the Freudian unconscious is ""structured like a language"" is well-known, but this was only the beginning. There was then the radically new thesis of the ""real unconscious"". Why this step? Searching for the Ariadne's thread that runs throughout Lacan's ever-evolving teaching, this book illuminates the questions implicit in each step, and sheds new light on his revisions and renewals of psychoanalytic concepts. In tracing these, the author brings out their consequences for the clinic, and in particular, for the subject, for symptoms, for affects, and for the aims of treatment itself. The last section of the book examines the political import of these developments. If many analysts since Freud have dreamt of reinventing psychoanalysis, the author shows the ways in which Lacan succeeded in this reinvention.",http://books.google.com/books/content?id=ThVWDwAAQBAJ&printsec=frontcover&img=1&zoom=1&edge=curl&source=gbs_api,['Colette Soler'],"[26, 27]","[433, 433]"
102,102,Lacan,['Psychology'],Routledge,2014,229.0,,,,,NOT_MATURE,en,"Has Jacques Lacan's impact on psychoanalysis really been assessed? His formulation that the Freudian unconscious is ""structured like a language"" is well-known, but this was only the beginning. There was then the radically new thesis of the ""real unconscious"". Why this step? Searching for the Ariadne's thread that runs throughout Lacan's ever-evolving teaching, this book illuminates the questions implicit in each step, and sheds new light on his revisions and renewals of psychoanalytic concepts. In tracing these, the author brings out their consequences for the clinic, and in particular, for the subject, for symptoms, for affects, and for the aims of treatment itself. The last section of the book examines the political import of these developments. If many analysts since Freud have dreamt of reinventing psychoanalysis, the author shows the ways in which Lacan succeeded in this reinvention.",http://books.google.com/books/content?id=V45HzAEACAAJ&printsec=frontcover&img=1&zoom=1&source=gbs_api,['Colette Soler'],"[26, 27]","[433, 433]"
103,103,Collected Stories of Colette,['Fiction'],Macmillan,1983,605.0,,,4.0,3.0,NOT_MATURE,en,"This comprehensive collection of one hundred short stories by the French writer ranges from a short fable to a novella and includes such popular masterpieces as ""Bella-Vista"" and ""The Tender Shoot.""",http://books.google.com/books/content?id=TVvoRX9IblIC&printsec=frontcover&img=1&zoom=1&edge=curl&source=gbs_api,['Colette'],[27],[]
104,104,The Vagabond,['Fiction'],Macmillan,2001-09-05,223.0,,,4.0,15.0,NOT_MATURE,en,"This vivid portrait of life in the music halls of early-20th-century Paris was drawn from the personal experiences of the author of Gigi. Colette's novel, first published in 1911, reflects her adventures as an itinerant cafe dancer as well as her struggles balancing respectability and artistic freedom.",http://books.google.com/books/content?id=oRZkLrxCrrQC&printsec=frontcover&img=1&zoom=1&edge=curl&source=gbs_api,['Colette'],[27],[]
105,105,The Complete Claudine,['Fiction'],Macmillan,2001-09-05,632.0,,,,,NOT_MATURE,en,"Colette, prodded by her first husband, Willy, began her writing career with Claudine at School, which catapulted the young author into instant, sensational success. Among the most autobiographical of Colette's works, these four novels are dominated by the child-woman Claudine, whose strength, humor, and zest for living make her seem almost a symbol for the life force. Janet Flanner described these books as ""amazing writing on the almost girlish search for the absolute of happiness in physical love . . . recorded by a literary brain always wide awake on the pillow.""",http://books.google.com/books/content?id=i0MrjKbN5A8C&printsec=frontcover&img=1&zoom=1&edge=curl&source=gbs_api,['Colette'],[27],[]
106,106,The Claudine Novels,['Fiction'],Penguin Group USA,1987,560.0,,,2.0,1.0,NOT_MATURE,en,Claudine fills a diary with her experiences growing up in France.,http://books.google.com/books/content?id=mPmRAAAAIAAJ&printsec=frontcover&img=1&zoom=1&source=gbs_api,['Colette'],[27],"[13, 56, 174]"
107,107,Chéri,"['Authors, French']",,1920,190.0,,,,,NOT_MATURE,fr,,http://books.google.com/books/content?id=K-6RAAAAIAAJ&printsec=frontcover&img=1&zoom=1&edge=curl&source=gbs_api,['Colette'],[27],[]
108,108,Belles Saisons,['Fiction'],"Farrar, Straus and Giroux",1978-11-01,304.0,,,,,NOT_MATURE,en,"Although Colette was first and always a verbal artist, she was also a very original human being, an earthbound, androgynous, profoundly French female whose personality so deeply saturates everything she wrote that her life continues to interest readers as much as her art. This work helps to illuminate the mystery at the heart of this author.",http://books.google.com/books/content?id=LbF1QgAACAAJ&printsec=frontcover&img=1&zoom=1&source=gbs_api,['Colette'],[27],[190]
109,109,Gigi and the Cat,"['Love stories, French']",Vintage Books USA,2003-07-28,160.0,,,3.5,9.0,NOT_MATURE,en,"In these two superb stories of the politics of love, Colette is at her witty, instinctive best. Gigi is being educated in the skills of the Courtesan: to choose cigars, to eat lobster, to enter a world where a woman's chief weapon is her body. However, when it comes to the question of Gaston Lachaille, very rich and very bored, Gigi does not want to obey the rules. In 'The Cat', a wonderful story of burgeoning sexuality and blossoming love, an exquisite strong-minded Russian Blue is struggling for mastery of Alain with his seductive fianc-e, Camille.",http://books.google.com/books/content?id=DGCoPwAACAAJ&printsec=frontcover&img=1&zoom=1&source=gbs_api,['Colette'],[27],[516]
110,110,"First Steps in French, by Margarita Madrigal and Colette Dulac",,,1964,112.0,,,,,NOT_MATURE,en,,,"['Margarita Madrigal', 'Colette Dulac']","[27, 29]",[]
111,111,See It and Say It in French,,Signet Book,1963-09,,,,,,NOT_MATURE,en,,http://books.google.com/books/content?id=FT4Gje4O2bYC&printsec=frontcover&img=1&zoom=1&source=gbs_api,"['Margarita Madrigal', 'Colette Dulac']","[27, 29]",[]
112,112,See It and Say It in French,,Signet,1969-05-01,,,,,,NOT_MATURE,en,,,"['Colette Dulac', 'Margarita Madrigal']","[27, 29]",[]
113,113,Shortcut to French,['French language'],Prentice Hall,1977,250.0,,,,,NOT_MATURE,en,,http://books.google.com/books/content?id=Y0xfjWD7VfsC&printsec=frontcover&img=1&zoom=1&source=gbs_api,['Colette Dulac'],"[27, 29]","[412, 412]"
114,114,Shortcut to French,['Foreign Language Study'],Prentice Hall,1987-05,109.0,,,,,NOT_MATURE,en,An introductory text designed to provide a basic working knowledge of French in a short time,http://books.google.com/books/content?id=eE640jzLWhYC&printsec=frontcover&img=1&zoom=1&source=gbs_api,['Colette Dulac'],"[27, 29]","[412, 412]"
115,115,First Steps in French,,Prentice Hall,1987,112.0,,,,,NOT_MATURE,en,,,"['M. Madrigal', 'Colette Dulac']","[27, 29]","[412, 412]"
116,116,First Steps in French,['French language'],Prentice Hall,1964,112.0,,,,,NOT_MATURE,en,,,"['Margarita Madrigal', 'Colette Dulac']","[27, 29]","[412, 412]"
117,117,Open Door to French,['French language'],,1963,182.0,,,,,NOT_MATURE,en,,,"['Margarita Madrigal', 'Colette Dulac']","[27, 29]",[]
118,118,Magic Key to French,,,1961,612.0,,,,,NOT_MATURE,en,,,"['Margarita Madrigal', 'Colette Dulac']","[27, 29]",[]
119,119,Open the Door to French,['Foreign Language Study'],Prentice Hall,1987-05,192.0,,,,,NOT_MATURE,en,,,"['Margarita Madrigal', 'Colette Dulac', 'Est Madrigal']","[27, 29]","[412, 412]"
120,120,Spanish Conversation for Students and Travelers,,Barron's Educational Series,1985-01-01,,,,,,NOT_MATURE,en,,,['Colette Dulac'],"[27, 29]",[]
121,121,Magic Key to French,['French language'],,1961,612.0,,,,,NOT_MATURE,en,,,"['Margarita Madrigal', 'Colette Dulac']","[27, 29]",[]
122,122,PCOS,['Health & Fitness'],HarperThorsons,2000,211.0,,,4.0,1.0,NOT_MATURE,en,"Explains the causes, symptoms, and treatment options of the condition, and discusses the importance of changing diet and lifestyle habits to improve emotional and physical well-being.",http://books.google.com/books/content?id=3w99rPA-hjsC&printsec=frontcover&img=1&zoom=1&source=gbs_api,"['Colette Harris', 'Adam Carey']","[27, 31]","[235, 235]"
123,123,The Ultimate PCOS Handbook,['Health & Fitness'],Conari Press,2008-09-01,416.0,,,5.0,2.0,NOT_MATURE,en,"Offers a plan to ease the physical symptoms and psychological effects of the disease using natural methods such as supplements, a healthy diet of fresh and whole foods, exercise, and complementary therapies.",http://books.google.com/books/content?id=MKzjyQ3RS3MC&printsec=frontcover&img=1&zoom=1&edge=curl&source=gbs_api,"['Colette Harris', 'Theresa Cheung']","[27, 31]",[]
124,124,The PCOS Diet Book,['Health & Fitness'],HarperThorsons,2002,368.0,,,4.0,1.0,NOT_MATURE,en,"Colette Harris provides a practical plan for sufferers of Polycystic Ovary Syndrome with various diets to suit each individual, accessible explanations of nutritional science and hormonal health, and an emphasis upon personal and emotional well-being.",http://books.google.com/books/content?id=ewo2hY4tgQoC&printsec=frontcover&img=1&zoom=1&source=gbs_api,"['Colette Harris', 'Theresa Cheung']","[27, 31]","[235, 235]"
125,125,PCOS and Your Fertility,['Health & Fitness'],Hay House Incorporated,2004,269.0,,,2.0,1.0,NOT_MATURE,en,"Have you ever had irregular periods? Do you find that you're always putting on weight? Do you feel harried, emotional, and upbeat one minutes, but down the next? Or do you struggle with adult acne or excess, unwanted facial and body hair? It's possible you have PCOS.Whether you're trying to get pregnant, wondering about your chances of having a child in the future, or wondering what on earth to do next, this book can help. Written by two women who have had PCOS at different stages of their fertility journeys, it will help you answer those unique PCOS questions, as well as give you the impetus to take action to boost your chances of fertility with simple self-help strategies.",http://books.google.com/books/content?id=RJrzwAEACAAJ&printsec=frontcover&img=1&zoom=1&source=gbs_api,"['Colette Harris', 'Theresa Cheung']","[27, 31]","[247, 247]"
126,126,Muslim Youth,['Political Science'],Routledge,2018-04-27,192.0,https://play.google.com/store/books/details?id=XptYDwAAQBAJ&rdid=book-XptYDwAAQBAJ&rdot=1&source=gbs_api,46.95,5.0,1.0,NOT_MATURE,en,This book presents a compelling ethnography of the changes Tajikistan faces at the turn of the twenty-first century as seen through the eyes of its youth. It discusses the ethnographic gaze on the tremendous cultural changes being played out in post-Soviet Tajikistan.,http://books.google.com/books/content?id=XptYDwAAQBAJ&printsec=frontcover&img=1&zoom=1&edge=curl&source=gbs_api,['Colette Harris'],"[27, 31]","[433, 433]"
127,127,Pcos and Your Fertility,"['Fertility, Human']",Hay House,2011,352.0,,,,,NOT_MATURE,en,"Ever had irregular periods? Do you find you're always putting on weight? Do you feel tired and emotional ,and up one minute, down the next? Or do you struggle with adult acne, hair loss, or facial and body hair where you don't want it? You could have PCOS, a hormonal health condition that affects one in ten women in the UK - and is one of the most common causes of fertility problems. So if you do have PCOS, chances are you have questions about fertility buzzing around your head: Am I fertile? What can I do to boost my chances of pregnancy? Will irregular periods stop me from getting pregnant? I've been trying for months - what next? Will fertility drugs help me? The good news is that no matter what stage you're at, this book can help. Written by two women with PCOS at different stages of their fertility journeys, it will help you:. discover how and why PCOS can affect your fertility. find out from the experts and other women how they have overcome non-conception. make a step-by-step action plan to enhance your fertility. work out which fertility treatments are best for you.",http://books.google.com/books/content?id=DexdzgAACAAJ&printsec=frontcover&img=1&zoom=1&source=gbs_api,['Colette Harris'],"[27, 31]","[247, 247]"
128,128,PCOS And Your Fertility,['Health & Fitness'],"Hay House, Inc",2011-12-05,179.0,https://play.google.com/store/books/details?id=NSFnDwAAQBAJ&rdid=book-NSFnDwAAQBAJ&rdot=1&source=gbs_api,1.99,2.0,1.0,NOT_MATURE,en,"Ever had irregular periods? Do you find you're always putting on weight? Do you feel tired and emotional ,and up one minute, down the next? Or do you struggle with adult acne, hair loss, or facial and body hair where you don't want it? You could have PCOS, a hormonal health condition that affects one in ten women in the UK – and is one of the most common causes of fertility problems. So if you do have PCOS, chances are you have questions about fertility buzzing around your head: Am I fertile? What can I do to boost my chances of pregnancy? Will irregular periods stop me from getting pregnant? I've been trying for months – what next? Will fertility drugs help me? The good news is that no matter what stage you're at, this book can help. Written by two women with PCOS at different stages of their fertility journeys, it will help you: • discover how and why PCOS can affect your fertility • find out from the experts and other women how they have overcome non-conception • make a step-by-step action plan to enhance your fertility • work out which fertility treatments are best for you.",http://books.google.com/books/content?id=NSFnDwAAQBAJ&printsec=frontcover&img=1&zoom=1&edge=curl&source=gbs_api,"['Colette Harris', 'Theresa Cheung']","[27, 31]","[247, 247]"
129,129,Control and Subversion,['Social Science'],Pluto Press,2004-03-20,216.0,,,4.0,1.0,NOT_MATURE,en,"Control and Subversion makes an important contribution to the study of Muslim societies in general, while also being a unique study of a neglected area – post-Soviet Tajikistan – a country gaining increasing importance in the international arena of Central Asia. The book presents an intimate view of this society, told through ethnographically collected life histories, unusually including men’s as well as women’s. Despite developing significant gender theories (notably reframing work of Judith Butler), and maintaining high academic standards, it remains as readable as a popular novel. Control and Subversion investigates the relationship of gender to the inner workings of social control, such as exposing ways in which Tajik society threatens men’s masculinity, thereby bringing them to force family members into conformity, irrespective of the suffering this may cause. It examines how masculine and feminine gender characteristics influence personal relationships and explores gender relations at their most intimate – from the secret musings of adolescent girls, through the painful experiences of young men, to the trauma of sexual initiation. Although largely concentrating on contemporary life, the book also discusses historical materials and Soviet influence on Tajik society. Control and Subversion is essential reading for anyone interested in Central Asia, Muslim societies, the lives of Muslim women, or gender in a Muslim context.",http://books.google.com/books/content?id=oR63AAAAIAAJ&printsec=frontcover&img=1&zoom=1&source=gbs_api,['Colette Harris'],"[27, 31]","[405, 405]"
130,130,You Can Beat PMS!: the 12-Week Plan to Banish: Mood Swings * Disturbed Sleep * Sugar Cravings * Bloating * Skin Problems * Irrational Crying * Headaches,['Health & Fitness'],HarperThorsons,2004,371.0,,,,,NOT_MATURE,en,"Offering a cure for PMS, the authors outline a twelve-week plan that focuses on nutrition, exercise, ""vitality boosters,"" and emotional mood lifters, using the quotes from real women to offer inspiration and advice to PMS sufferers. Original.",http://books.google.com/books/content?id=kUJ_q5xmt10C&printsec=frontcover&img=1&zoom=1&source=gbs_api,"['Colette Harris', 'Theresa Cheung']","[27, 31]","[235, 235]"
131,131,The PCOS Protection Plan,['Polycystic ovary syndrome'],Hay House,2005,322.0,,,,,NOT_MATURE,en,"Following on from their successful book 'PCOS and Your Fertility' Colette Harris and Theresa Chung have written a plan on how to protect yourself from the symptoms of PCOS. This book explores how serious health conditions linked to PCOS such as heart disease, diabetes and obesity can be faced in an upbeat and positive way. It is written in a positive and inspirational way to help women living with the condition to take control of their symptoms and move forward with their lives. This book is a protective action plan to help you reduce your PCOS-associated health risks for the long term by taking steps with your diet, lifestyle and healthcare in ways which are carefully designed to help you reduce your PCOS symptoms day to day as well as long term.",http://books.google.com/books/content?id=F1KfAAAACAAJ&printsec=frontcover&img=1&zoom=1&source=gbs_api,['Colette Harris'],"[27, 31]","[247, 247]"
132,132,Seasonal Patchwork & Quilting,['Art'],Better Homes & Gardens Books,1991,144.0,,,,,NOT_MATURE,en,"Patchwork and quilting projects that reflect the seasons of the year in color, fabric, and theme include instructions for creating bridal gifts, an autumn table setting, and decorative items for Christmas",http://books.google.com/books/content?id=X3-fSiSsu58C&printsec=frontcover&img=1&zoom=1&source=gbs_api,['Colette Wolff'],"[27, 33]",[]
133,133,Rebent Sinner,['Social Science'],arsenal pulp press,2019-11-19,,https://play.google.com/store/books/details?id=hQmZDwAAQBAJ&rdid=book-hQmZDwAAQBAJ&rdot=1&source=gbs_api,10.99,,,MATURE,en,"Ivan Coyote is one of North America’s preeminent storytellers and performers; they are the author, co-author, or co-editor of eleven previous books, and their TED talk has received over 1.6 million views online. Their most recent book, Tomboy Survival Guide, was shortlisted for the Hilary Weston Writers’ Trust of Canada Prize for Non-Fiction and was named an American Library Association Stonewall Honor Book. In their latest, Ivan takes on the patriarchy and the political, as well as the intimate and the personal in these beguiling and revealing stories of what it means to be trans and non-binary today, at a time in their life when they must carry the burden of heartbreaking history with them, while combatting those who would misgender them or deny their very existence. These stories span thirty years of tackling TERFs, legislators, and bathroom police, sure, but there is joy and pleasure and triumph to be found here too, as Ivan pays homage to personal heroes like Leslie Feinberg and Ferron while gently guiding younger trans folk to prove to themselves that there is a way out of the darkness. Rebent Sinner is the work of an accomplished artist whose plain truths about their experience will astound readers with their utter, breathtaking humanity.",http://books.google.com/books/content?id=hQmZDwAAQBAJ&printsec=frontcover&img=1&zoom=1&edge=curl&source=gbs_api,['Ivan Coyote'],[37],[]
134,134,Close to Spider Man,['Fiction'],arsenal pulp press,2002-07-01,96.0,https://play.google.com/store/books/details?id=kq02DwAAQBAJ&rdid=book-kq02DwAAQBAJ&rdot=1&source=gbs_api,11.99,5.0,1.0,MATURE,en,"Close to Spider Man marks the debut of an exciting new literary talent: a collection of connected stories whose female narrators seek out lives for themselves amidst the lonely, breathtaking landscape of the Yukon. The young women in Ivan Coyote's deeply personal stories are looking to make a break from their circumstances, but the North is in their bones: so is their connections to family, friends, and other women. Like the protagonist in the title story, a waitress whose attempts to help a young co-worker saddled with a lunatic father finds her running across rooftops and climbing ladders; by getting close to Spider Man, she gets closer to freedom. Startling in their intimacy, the stories in Close to Spider Man make up a moving scrapbook of what it's like to be a young queer woman in the North, journeys imbued with the colours of a prescient sexuality and an honest heart. Runner-up, Danuta Gleed Award for Short-Fiction",http://books.google.com/books/content?id=kq02DwAAQBAJ&printsec=frontcover&img=1&zoom=1&edge=curl&source=gbs_api,['Ivan Coyote'],[37],[]
135,135,Tomboy Survival Guide,['Biography & Autobiography'],arsenal pulp press,2016-10-10,208.0,https://play.google.com/store/books/details?id=cq42DwAAQBAJ&rdid=book-cq42DwAAQBAJ&rdot=1&source=gbs_api,11.99,4.0,3.0,MATURE,en,"Stonewall Book Award Honor Book winner Ivan Coyote is a celebrated storyteller and the author of ten previous books, including Gender Failure (with Rae Spoon) and One in Every Crowd, a collection for LGBT youth. Tomboy Survival Guide is a funny and moving memoir told in stories, in which Ivan recounts the pleasures and difficulties of growing up a tomboy in Canada’s Yukon, and how they learned to embrace their tomboy past while carving out a space for those of us who don’t fit neatly into boxes or identities or labels. Ivan writes movingly about many firsts: the first time they were mistaken for a boy; the first time they purposely discarded their bikini top so they could join the boys at the local swimming pool; and the first time they were chastised for using the women’s washroom. Ivan also explores their years as a young butch, dealing with new infatuations and old baggage, and life as a gender-box-defying adult, in which they offer advice to young people while seeking guidance from others. (And for tomboys in training, there are even directions on building your very own unicorn trap.) Tomboy Survival Guide warmly recounts Ivan’s adventures and mishaps as a diffident yet free-spirited tomboy, and maps their journey through treacherous gender landscapes and a maze of labels that don’t quite stick, to a place of self-acceptance and an authentic and personal strength. These heartfelt, funny, and moving stories are about the culture of difference—a “guide” to being true to one’s self.",http://books.google.com/books/content?id=cq42DwAAQBAJ&printsec=frontcover&img=1&zoom=1&edge=curl&source=gbs_api,['Ivan Coyote'],[37],[]
