,id,name,genres,publisher,year,page_count,purchase_link,price,avg_rating,num_ratings,maturity_rating,language,description,image,authors,AuthorConnections,PublisherConnections
0,0,Bastard Out of Carolina,['Fiction'],Penguin,2005-09-06,336.0,https://play.google.com/store/books/details?id=vP-O7CeZET8C&rdid=book-vP-O7CeZET8C&rdot=1&source=gbs_api,9.99,4.0,68.0,NOT_MATURE,en,"A profound portrait of family dynamics in the rural South and “an essential novel” (The New Yorker) “As close to flawless as any reader could ask for . . . The living language [Allison] has created is as exact and innovative as the language of To Kill a Mockingbird and The Catcher in the Rye.” —The New York Times Book Review The publication of Dorothy Allison’s Bastard Out of Carolina was a landmark event that won the author a National Book Award nomination and launched her into the literary spotlight. Critics have likened Allison to Harper Lee, naming her the first writer of her generation to dramatize the lives and language of poor whites in the South. Since its appearance, the novel has inspired an award-winning film and has been banned from libraries and classrooms, championed by fans, and defended by critics. Greenville County, South Carolina, is a wild, lush place that is home to the Boatwright family—a tight-knit clan of rough-hewn, hard-drinking men who shoot up each other’s trucks, and indomitable women who get married young and age too quickly. At the heart of this story is Ruth Anne Boatwright, known simply as Bone, a bastard child who observes the world around her with a mercilessly keen perspective. When her stepfather Daddy Glen, “cold as death, mean as a snake,” becomes increasingly more vicious toward her, Bone finds herself caught in a family triangle that tests the loyalty of her mother, Anney—and leads to a final, harrowing encounter from which there can be no turning back.",http://books.google.com/books/content?id=vP-O7CeZET8C&printsec=frontcover&img=1&zoom=1&edge=curl&source=gbs_api,['Dorothy Allison'],[1],[]
1,1,Two or Three Things I Know for Sure,['Biography & Autobiography'],Penguin,1996-08-01,112.0,https://play.google.com/store/books/details?id=xGDfLNLBHGcC&rdid=book-xGDfLNLBHGcC&rdot=1&source=gbs_api,11.99,4.0,8.0,NOT_MATURE,en,"Bastard Out of Carolina, nominated for the 1992 National Book Award for fiction, introduced Dorothy Allison as one of the most passionate and gifted writers of her generation. Now, in Two or Three Things I Know for Sure, she takes a probing look at her family's history to give us a lyrical, complex memoir that explores how the gossip of one generation can become legends for the next. Illustrated with photographs from the author's personal collection, Two or Three Things I Know for Sure tells the story of the Gibson women -- sisters, cousins, daughters, and aunts -- and the men who loved them, often abused them, and, nonetheless, shared their destinies. With luminous clarity, Allison explores how desire surprises and what power feels like to a young girl as she confronts abuse. As always, Dorothy Allison is provocative, confrontational, and brutally honest. Two or Three Things I Know for Sure, steeped in the hard-won wisdom of experience, expresses the strength of her unique vision with beauty and eloquence.",http://books.google.com/books/content?id=xGDfLNLBHGcC&printsec=frontcover&img=1&zoom=1&edge=curl&source=gbs_api,['Dorothy Allison'],[1],[]
2,2,Nightwood,['Fiction'],New Directions Publishing,2006,182.0,,,2.0,1.0,MATURE,en,"Barnes' famous experimental novel tells of a young woman, Robin Vote, in 1920s Paris, who first marries the ""Baron"" Felix Volkbien, and later has love affairs with two women.",http://books.google.com/books/content?id=v6iZL5n5cLwC&printsec=frontcover&img=1&zoom=1&edge=curl&source=gbs_api,['Djuna Barnes'],[5],[358]
3,3,Nightwood,['Fiction in English'],London : Faber,1950,239.0,,,2.5,19.0,NOT_MATURE,en,The fiery and enigmatic masterpiece-one of the greatest novels of the Modernist era.,,"['Djuna Barnes', 'Thomas Stearns Eliot']",[5],[]
4,4,Vivid and Repulsive as the Truth,['Literary Collections'],Courier Dover Publications,2016-08-17,272.0,,,,,NOT_MATURE,en,"The self-described ""most famous unknown author in the world,"" Djuna Barnes (1892 - 1982) is increasingly regarded as an important voice of feminism, modernism, and lesbian culture. Best remembered for her 1936 novel Nightwood, Barnes began her career by writing poetry, short stories, and articles for avant-garde literary journals as well as popular magazines. She took the grotesque nature of reality as her recurrent theme, a pessimistic world view frequently brightened by her sparkling wit. A longtime resident of Greenwich Village, Barnes drew inspiration from the bustling streets of Lower Manhattan, and this eclectic compilation of her early journalism, fiction, and poetry recaptures the vitality of her bohemian literary scene. The collection opens with articles ranging from an account of an evening at the Arcadia, a ""modern dance hall,"" to a firsthand report of the force-feeding endured by suffragettes in 1914. In addition to profiles of a postman, vaudeville performer, and other local personalities, Barnes interviews Lillian Russell and Alfred Stieglitz and describes an encounter with James Joyce. A dozen short stories follow, and the book concludes with a selection of compelling and sensual poetry, including verse from The Book of Repulsive Women. A selection of the author's original illustrations is included.",http://books.google.com/books/content?id=zLSoDAAAQBAJ&printsec=frontcover&img=1&zoom=1&edge=curl&source=gbs_api,['Djuna Barnes'],[5],[170]
5,5,Ladies Almanack,['Fiction'],Dalkey Archive Press,1992,91.0,,,,,NOT_MATURE,en,"""Now this be a Tale of as fine a Wench as ever wet Bed . . . Thus begins this Almanack, which all Ladies should carry about with them, as the Priest his Breviary, as the Cook his Recipes, as the Doctor his Physic, as the Bride her Fears, and as the Lion his Roar!""",http://books.google.com/books/content?id=O2HLJMQhULAC&printsec=frontcover&img=1&zoom=1&edge=curl&source=gbs_api,['Djuna Barnes'],[5],[152]
6,6,The Lydia Steptoe Stories,['Fiction'],Faber & Faber,2019-01-03,48.0,https://play.google.com/store/books/details?id=Rr5_DwAAQBAJ&rdid=book-Rr5_DwAAQBAJ&rdot=1&source=gbs_api,2.99,4.0,1.0,NOT_MATURE,en,"'I have quite changed my mind. I am going to run away and become a boy.' In these three stories, written by Djuna Barnes under the pseudonym Lydia Steptoe, three characters find themselves on the brink of a sexual awakening - accompanied by guns, whips, and worldly innuendo. A fourteen-year-old girl plans to become 'a virago', until her mother intercepts her first tryst by dressing up as her male lover. A boy of the same age is lured into the forest by his father's mistress. A woman of forty falls in love and longs to kill herself, so unbearable is the return of the youth she thought she wanted. 'Alice', she tells herself, 'be a man.' Barnes makes gender and desire seem slippery and joyful - and makes the fictional Lydia Steptoe seem like a writer for our time.",http://books.google.com/books/content?id=Rr5_DwAAQBAJ&printsec=frontcover&img=1&zoom=1&edge=curl&source=gbs_api,['Djuna Barnes'],[5],[]
7,7,Collected Poems,['Biography & Autobiography'],Univ of Wisconsin Press,2005,285.0,,,,,MATURE,en,"This collection of many unpublished works of American writer Djuna Barnes is accompanied by her autobiographical notes which describe the expatriate scene in Paris during the 1920s, including her interactions with James Joyce and Gertrude Stein and her intimate recollections of T.S. Eliot.",http://books.google.com/books/content?id=uem1fupBTMQC&printsec=frontcover&img=1&zoom=1&edge=curl&source=gbs_api,['Djuna Barnes'],[5],[]
8,8,Nightwood,['Fiction'],New Directions Publishing Corporation,1961,170.0,,,2.5,19.0,MATURE,en,"The impassioned monologues of Doctor Dante O'Connor reveal the story of Robin Vote, a young American woman in interwar Paris, whose fate is the destruction of all who love her",http://books.google.com/books/content?id=yIyfymFMb_cC&printsec=frontcover&img=1&zoom=1&source=gbs_api,"['Djuna Barnes', 'Thomas Stearns Eliot']",[5],[358]
9,9,New York,['Fiction'],Sun and Moon Press,1989,354.0,,,,,NOT_MATURE,en,Selection of pieces written for various publications between 1913 and 1919.,http://books.google.com/books/content?id=5z9aAAAAMAAJ&printsec=frontcover&img=1&zoom=1&source=gbs_api,['Djuna Barnes'],[5],[]
10,10,The Book of Repulsive Women and Other Poems,['Poetry'],Psychology Press,2003,83.0,,,,,NOT_MATURE,en,"First published in 2004. Routledge is an imprint of Taylor & Francis, an informa company.",http://books.google.com/books/content?id=-4A0xb18iJYC&printsec=frontcover&img=1&zoom=1&edge=curl&source=gbs_api,['Djuna Barnes'],[5],[]
11,11,Selected Works of Djuna Barnes,['Fiction in English'],,1998,366.0,,,2.5,2.0,NOT_MATURE,en,"The best writings of one of the great twentieth-century American stylists, whose extraordinary novel Nightwood, about rootless and sexually ambiguous expatriates in Paris between the wars, is a modern classic. T. S. Eliot praised it for 'the great achievement of a style, the beauty of phrasing, the brilliance of wit and characterisation, and the quality of horror and doom very nearly related to that of Elizabethan tragedy'. As well as Nightwood this striking volume contains Spillway, a collection of early stories, and the rare and remarkable verse play The Antiphon, completed at the end of Djuna Barnes's life.",http://books.google.com/books/content?id=MPVNHQAACAAJ&printsec=frontcover&img=1&zoom=1&source=gbs_api,['Djuna Barnes'],[5],[]
12,12,Lydia Steptoe Stories,['Man-woman relationships'],Faber & Faber Limited,2019-01-03,48.0,,,4.0,1.0,NOT_MATURE,en,"In these three stories, written by Djuna Barnes under the pseudonym Lydia Steptoe, three characters find themselves on the brink of a sexual awakening - accompanied by guns, whips, and worldly innuendo.",http://books.google.com/books/content?id=S9fuugEACAAJ&printsec=frontcover&img=1&zoom=1&source=gbs_api,['Djuna Barnes'],[5],[]
13,13,The Antiphon,['Drama'],Green Integer Books,2000,203.0,,,,,NOT_MATURE,en,The important long play by Djuna Barnes.,http://books.google.com/books/content?id=3ttiPQAACAAJ&printsec=frontcover&img=1&zoom=1&source=gbs_api,['Djuna Barnes'],[5],[]
14,14,Poe's Mother,['Art'],Sun and Moon Press,1995,241.0,,,,,NOT_MATURE,en,,http://books.google.com/books/content?id=lX9xQgAACAAJ&printsec=frontcover&img=1&zoom=1&source=gbs_api,"['Djuna Barnes', 'Douglas Messerli']",[5],[]
15,15,Ryder,,,1979,323.0,,,,,NOT_MATURE,en,,,['Djuna Barnes'],[5],[]
16,16,At the Roots of the Stars,['Drama'],Sun and Moon Press,1995,190.0,,,,,NOT_MATURE,en,,http://books.google.com/books/content?id=Nx9aAAAAMAAJ&printsec=frontcover&img=1&zoom=1&source=gbs_api,['Djuna Barnes'],[5],[]
17,17,"Smoke, and Other Early Stories",['Manners and customs'],"College Park, Md. : Sun & Moon Press",1982,180.0,,,,,NOT_MATURE,en,,http://books.google.com/books/content?id=OdiVswEACAAJ&printsec=frontcover&img=1&zoom=1&source=gbs_api,['Djuna Barnes'],[5],[]
18,18,Creatures in an Alphabet,['Alphabet rhymes'],Dell Books for Young Readers,1982,64.0,,,,,NOT_MATURE,en,Vierregelige gedichten over dieren.,http://books.google.com/books/content?id=UD9aAAAAMAAJ&printsec=frontcover&img=1&zoom=1&source=gbs_api,['Djuna Barnes'],[5],[]
19,19,Pecho frío,['Fiction'],Vintage Espanol,2018-11-06,368.0,,,,,NOT_MATURE,en,"A menudo controvertido, pero siempre muy directo, Jaime Bayly impresionará a sus lectores con esta nueva novela de ficción satírica y sumamente humorística, en la que explora el lugar de la homosexualidad en la sociedad latinoamericana y desafía el status quo. Pecho Frío es un hombre común. Está casado, vive en Lima, Perú y trabaja como banquero. No lleva una vida muy emocionante, pero tampoco tiene nada de que quejarse... hasta el día en que decide concursar en un programa de televisión donde se enfrenta con la oportunidad de ganar un viaje lujoso. Todo lo que tiene que hacer es una cosa aparentemente sencilla: besar al anfitrión del programa. Renuente, pero también ansioso por reclamar su premio, acepta el reto, y antes de siquiera darse cuenta, se encuentra entrelazando lenguas con otro hombre, mientras todo queda grabado en televisión en vivo. Lo que se desarrolla es una serie de, uno diría, ""eventos desafortunados"". Su matrimonio se resquebraja, sus colegas lo rechazan, y la siempre conservadora sociedad latinoamericana en la que vive lo convierte en el tonto de la ciudad. Pero hay una ventaja: se convierte en la cara de una vociferante organización LGBT y, de alguna manera, su vida da un giro hacia lo inesperado.",http://books.google.com/books/content?id=oJNbDwAAQBAJ&printsec=frontcover&img=1&zoom=1&edge=curl&source=gbs_api,['Jaime Bayly'],[6],[]
20,20,El huracán lleva tu nombre,['Fiction'],Planeta Publishing Corporation,2004,462.0,,,5.0,1.0,NOT_MATURE,es,"Gabriel ama a Sofía pero también le gustan los hombres. Gabriel tiene mucho éxito en televisión, pero lo que ansía de verdad es huir del Perú y dedicarse sólo a a escribir, lejos de la ambigüedad y de la hipocresía que lo envuelven y lo limitan. El huracán lleva tu nombre es una singular historia de amor, dolorosa y gozosa a la vez, con una heroína, Sofía, que fascina por su capacidad de amar, y con un original antihéroe, el narrador, Gabriel, que expone al lector su conflicto a través de una sinceridad a veces hilarante y a veces conmovedora. Una novela que no va a dejar a nadie indiferente.",http://books.google.com/books/content?id=a6ddAAAAMAAJ&printsec=frontcover&img=1&zoom=1&source=gbs_api,['Jaime Bayly'],[6],[]
21,21,Pecho Frío,['Fiction'],Vintage Espanol,2018,336.0,,,,,NOT_MATURE,es,"""Un día cualquiera, Pecho Frío, tímido empleado bancario, asiste a un programa concurso de TV. Cuando lo eligen para participar en una serie de pruebas, de las cuales el premio mayor es un viaje a Punta Sal, la audiencia lo anima a besar en la boca al animador. Ese inocente beso lo cambia todo. Llevado por las circunstancias, por sus desbordadas abiciones y por su condición de pelele al servicio de intereses mayores, nuestro epleado bancario se convertirá en personaje de noticieros, en líder del Movimienot Homosxual, en amante heterosexual impetuoso, en candidado al Congreso de le República y en prófugo de la justicia. La farsa, con sus acontecimientos y personajes esperpénticos, es espejo y respresentación de la realidad que nos rodea y dejará al lecotr, entre el humor y la sátira, frente a la imagen desnuda de un país de opereta.""--Page 4 de la couverture.",http://books.google.com/books/content?id=R8JyDwAAQBAJ&printsec=frontcover&img=1&zoom=1&edge=curl&source=gbs_api,['Jaime Bayly'],[6],[]
22,22,Mapp and Lucia,['Fiction'],McClelland & Stewart,2015-07-07,251.0,,,4.5,17.0,NOT_MATURE,en,"The fourth volume of E.F. Benson’s wildly satirical take on the Edwardian English upper class. The books were recently adapted by the BBC into a mini-series starring Sherlock’s Mark Gatiss. Miss Elizabeth Mapp is the undisputed queen of the social scene in the village of Tilling – undisputed, that is, until the arrival of Emmeline “Lucia” Lucas, someone just as clever and determined as she is. The two women, backed by their respective coteries, clash for dominance over the local society scene. Penguin Random House Canada is proud to bring you classic works of literature in e-book form, with the highest quality production values. Find more today and rediscover books you never knew you loved.",http://books.google.com/books/content?id=3t0mCgAAQBAJ&printsec=frontcover&img=1&zoom=1&source=gbs_api,['E. F. Benson'],[8],[331]
23,23,Poems: North & South,['American poetry'],,1955,95.0,,,,,NOT_MATURE,en,,http://books.google.com/books/content?id=k_wOAQAAMAAJ&printsec=frontcover&img=1&zoom=1&source=gbs_api,['Elizabeth Bishop'],[9],[]
24,24,The Complete Poems 1927-1979,['American poetry'],Chatto & Windus,1984,287.0,,,4.0,9.0,NOT_MATURE,en,,,['Elizabeth Bishop'],[9],[123]
25,25,Songs for Angel,['Fiction'],House of Anansi,2021-07-06,184.0,https://play.google.com/store/books/details?id=p30DEAAAQBAJ&rdid=book-p30DEAAAQBAJ&rdot=1&source=gbs_api,16.95,,,NOT_MATURE,en,"The ninth novel in internationally acclaimed author Marie-Claire Blais’s extraordinary Soifs cycle, Songs for Angel is an impassioned interrogation of violence and hate that takes us into the soul of a white supremacist on the verge of a racist attack. In the penultimate installment of the magnificent and ambitious Soifs cycle, widely regarded as one of the most original and ambitious endeavors ever to be undertaken in contemporary literature, renowned novelist Marie-Claire Blais once again marries the highest artistic standards with the most pressing human and political concerns. Revisiting figures from the previous novels in a swirling fresco of more than a hundred characters, Blais also takes us into the soul of “the Young Man,” a white supremacist preparing to attack a Black church and murder its entire congregation. This is an extraordinary portrait of the times that jostles and discomboluates the reader while inviting us to see the world in all its injustice and distress, but also its promise and beauty. Songs for Angel reminds us that Blais is a writer who never ceases to situate us in the world and the roles we play in it, and that reading her is always an unforgettable human experience.",http://books.google.com/books/content?id=p30DEAAAQBAJ&printsec=frontcover&img=1&zoom=1&edge=curl&source=gbs_api,['Marie-Claire Blais'],[10],[]
26,26,A Twilight Celebration,['Fiction'],House of Anansi,2019-07-30,288.0,https://play.google.com/store/books/details?id=rLSGDwAAQBAJ&rdid=book-rLSGDwAAQBAJ&rdot=1&source=gbs_api,16.95,,,NOT_MATURE,en,"The latest work in internationally acclaimed author Marie-Claire Blais’s masterful novel cycle, A Twilight Celebration examines the prophetic side of the writer and the burden that falls to him in a world whose fate is yet to be determined. Daniel, a middle-aged novelist and loving father alienated from one of his sons and unsure how to care for his daughter, is on his way to an international conference of writers. The gathering is to be held in the forest above a mountain village of a strangely dreamlike nature. In the twilight of the festival’s setting, dreams, memories, nightmares, and dark forebodings meld in Daniel’s unsettled but deeply sympathetic consciousness: He is haunted by pressing existential questions: What is to be done? What are his responsibilities as a father, as a friend — and as a writer? As Daniel confronts his own vanities, as he recalls the activism but also the disappointments and betrayals of friends and colleagues — as he contends with, above all, the fears and aspirations of his children in times marred by apocalypse, he asks, ultimately, what can be done? In what may well be the most beautiful and disturbing of her novels, Marie-Claire Blais leads us on a heady, spellbinding journey through an interconnected world in which the artist strives to divert humankind’s headlong rush towards a terrible destiny. Here is a world in which friends and strangers, the living, the dead and those not yet born, are inextricably bonded by their often flawed but always splendid humanity. Yet again, Blais captivates with her urgent concerns, irrepressible empathy, and singular idiom: A Twilight Celebration is an astonishing literary accomplishment.",http://books.google.com/books/content?id=rLSGDwAAQBAJ&printsec=frontcover&img=1&zoom=1&edge=curl&source=gbs_api,['Marie-Claire Blais'],[10],[]
27,27,Mai at the Predators' Ball,['Fiction'],House of Anansi,2012,240.0,,,,,NOT_MATURE,en,"A group of imaginary beings perform every night at the Saloon, welcoming the outsiders of society and giving them a place to belong in this new novel from the award-winning and internationally renowned author of La Belle Bête (Mad Shadows). Original.",http://books.google.com/books/content?id=NxunPEfW0oQC&printsec=frontcover&img=1&zoom=1&edge=curl&source=gbs_api,['Marie-Claire Blais'],[10],[]
28,28,American Notebooks,['Biography & Autobiography'],"Burnaby, B.C. : Talonbooks",1996,207.0,,,,,NOT_MATURE,en,"Portraits of the writers, musicians, artists and social activists who influenced the life and work of Blais in the 1960s.",http://books.google.com/books/content?id=F3xcAAAAMAAJ&printsec=frontcover&img=1&zoom=1&source=gbs_api,['Marie-Claire Blais'],[10],[]
29,29,These Festive Nights,['Fiction'],House of Anansi,2018-08-07,312.0,https://play.google.com/store/books/details?id=m1BtDwAAQBAJ&rdid=book-m1BtDwAAQBAJ&rdot=1&source=gbs_api,14.95,,,NOT_MATURE,en,"The first volume in the beloved novelist Marie-Claire Blais’ prize-winning novel cycle — acclaimed as one of the greatest undertakings in modern Quebec fiction — reissued in a handsome A List edition, featuring an introduction by Lisa Moore. Originally published in 1995 under the title Soifs, the first novel in Marie-Claire Blais’ masterful series won the Governor General’s Award for French Fiction and was hailed by critics around the world as a tour de force, comparing Blais to such literary greats as Virginia Woolf, Dante, Sophocles, and Shakespeare. In this dazzling rendering, These Festive Nights, celebrated translator Sheila Fischman brings Blais’ novel to life for English-speaking readers. A sun-drenched paradise in the Gulf of Mexico surrounded by the glimmering blue sea; Renata is convalescing on this island poised between two worlds: between great wealth and extreme poverty, between the past and an uncertain future, between the beauty of the world and the horrors of history. During her time here, Renata becomes tormented by thirst — for justice, for pleasure, for intoxication — while all around her, festivities are going on in joint celebration of the birth of baby Vincent and the end of the twentieth century. Over the course of three days and three nights a flock of characters assembles — an entire spectrum of humanity is depicted in the grip of doubt and suffering. In this swirling, baroque fresco, Marie-Claire Blais captures the essence of our apocalyptic age, rendering it in powerfully evocative prose.",http://books.google.com/books/content?id=m1BtDwAAQBAJ&printsec=frontcover&img=1&zoom=1&edge=curl&source=gbs_api,['Marie-Claire Blais'],[10],[]
30,30,The Collected Stage Drama of Marie-Claire Blais,['Drama'],Cormorant Books,2008-05-30,400.0,,,,,NOT_MATURE,en,"Best known as the most important voice in Quobcois fiction of the last fifty years, Marie-Claire Blais is also an accomplished playwright. Her works have been performed in French on Radio-Canada, and on the stages of Montreal and Quebec City. In her stage plays, as with her radio plays and her fiction, Marie-Claire Blais works from a post-religious world view, but with the structures of religion in place; in short, she is a contemporary Dante, writing about good and evil in a civil context. Her characters, however, are more than just symbols; they are real people, struggling with moral dilemmas. In the novel, A Season in the Life of Emmanuel, Blais wrote from the point of view of a child under a table; the point of view itself was a metaphor for the society in which she found herself in the late 1950s and early 1960s, just prior to Quebec_s Quiet Revolution. The plays included in this edition are evidence of Blais_ great talent when brought to bear on the theatre, especially in the plays The Execution, Desire, and Envy.",,['Marie-Claire Blais'],[10],[]
31,31,Deaf to the City,['Social Science'],"Exile Editions, Ltd.",2007-06,187.0,,,,,NOT_MATURE,en,"This compelling story explores the motley crew of characters--including mother-turned-stripper Gloria, alcoholic Tim, frequent jailbird Charlie, and the suicidal wife of a rich doctor--who call the rundown Hôtel des Voyageurs home. Mesmerizing in its passion and humility, the narrative evokes the despair and innocence present in modern urban surroundings.",http://books.google.com/books/content?id=uMellzp3iBQC&printsec=frontcover&img=1&zoom=1&edge=curl&source=gbs_api,['Marie-Claire Blais'],[10],[]
32,32,Augustino and the Choir of Destruction,['Fiction'],House of Anansi,2007-05-01,232.0,https://play.google.com/store/books/details?id=PN5hAwAAQBAJ&rdid=book-PN5hAwAAQBAJ&rdot=1&source=gbs_api,16.95,,,NOT_MATURE,en,"In Augustino and the Choir of Destrucion literary legend and three-time winner of the Governor General's Literary Award Marie-Claire Blais delivers the third volume in the prize-winning series (These Festive Nights, Thunder and Light, Augustino and the Choir of Destruction, and Rebecca, Born in the Maelstrom) acclaimed as one of the greatest undertakings in modern Quebec fiction. Augustino and the Choir of Destruction is set on an island in the Gulf of Mexico that is home to the full spectrum of humanity: the rich, the poor, the powerful, the humble, artists, criminals. With her unique, signature use of punctuation, Marie-Claire Blais manages to brilliantly show in one flashing stroke men and women; victims and tormentors; child kamikaze pilots and petty thieves from Bahama Street; Charles, a great poet cut down by AIDS; Cinderella, a transvestite prostituting himself to a customer at the Porte du Baiser saloon; Caroline, an artist and photographer who has seen all the hidden treasures of the world; and Augustino, a clairvoyant child-writer. These individual destinies combine in Blais' vision to form a single harmonic texture.",http://books.google.com/books/content?id=PN5hAwAAQBAJ&printsec=frontcover&img=1&zoom=1&edge=curl&source=gbs_api,['Marie-Claire Blais'],[10],[]
